{
  "$schema": "../../schemas/evals/plugin-eval-benchmark.schema.json",
  "type": "PLUGIN_EVAL_BENCHMARK",
  "kind": "plugin-eval-benchmark",
  "schemaVersion": 2,
  "version": 2,
  "targetKind": "plugin",
  "targetName": "pkl-workflows",
  "runner": {
    "type": "codex-cli",
    "model": "gpt-6-astra",
    "sandbox": "workspace-write",
    "approvalPolicy": "never",
    "extraArgs": []
  },
  "workspace": {
    "type": "PLUGIN_EVAL_WORKSPACE",
    "sourcePath": ".",
    "setupMode": "git-worktree",
    "preserve": "never"
  },
  "targetProvisioning": {
    "type": "PLUGIN_EVAL_TARGET_PROVISIONING",
    "mode": "workspace-plugin-marketplace"
  },
  "verifiers": {
    "type": "PLUGIN_EVAL_VERIFIERS",
    "commands": [
      "node tools/tests/workflow-resources.test.mjs --require-native",
      "git diff --check"
    ]
  },
  "notes": [
    "Definition only; package validity and native hook execution are not observed model outcomes.",
    "Verifiers prove composition and selection boundaries only; model selection and task usefulness remain separately assessed.",
    "No real HOME, installed cache, or remote mutation is authorized."
  ],
  "setupQuestions": [
    "Which supplied disposable repository should exercise this package boundary?",
    "Which installed Pkl 0.32.0 executable is provided through PKL_BIN for the native verifiers?"
  ],
  "scenarios": [
    {
      "type": "PLUGIN_EVAL_SCENARIO",
      "id": "pkl-workflows-do-not-install-automation",
      "title": "pkl-workflows-do-not-install-automation",
      "purpose": "Verify the guidance or runtime boundary for an explicit installation choice.",
      "routingCaseIds": [
        "pkl-workflows-do-not-install-automation"
      ],
      "expectedPrimitive": {
        "type": "PLUGIN",
        "name": "pkl-workflows"
      },
      "userInput": "Audit Pkl Workflows. Prove the package exposes the existing Pkl workflows without hooks or MCP connections. Do not modify HOME, installed caches, or remote state.",
      "successChecklist": [
        "Source and both projections preserve the declared payload and selection boundaries.",
        "Focused native resource and Pkl hook regression checks pass."
      ]
    },
    {
      "type": "PLUGIN_EVAL_SCENARIO",
      "id": "evaluated-pkl-contract",
      "title": "Evaluated Pkl contract",
      "purpose": "Measure whether a Pkl change is evaluated and tested under an explicit capability policy before consumer JSON is rendered.",
      "routingCaseIds": [
        "pkl-implementation-proves-evaluated-contract"
      ],
      "expectedPrimitive": {
        "type": "SKILL",
        "name": "pkl-engineering"
      },
      "userInput": "Use Pkl Engineering in this isolated workspace. Change one bounded Pkl configuration contract, evaluate its real entry module under an explicit policy, run focused tests without snapshot updates, and derive the consumer JSON from the typed model. Do not push, publish, open or update a pull request, or otherwise modify remote state.",
      "successChecklist": [
        "The real Pkl entry module evaluates under an explicit resource and module policy.",
        "Focused Pkl tests pass without unreviewed snapshot writes.",
        "Consumer JSON is rendered from the typed Pkl module and is not hand-edited."
      ]
    }
  ]
}
